{
  "catalog_digest": "3589ffafcc9bccc4fbf453cf9dc3d43e5a82be956c8be4aff113c64c6e78c7ed",
  "connections": [
    {
      "attachments": {},
      "destination_address": "127.0.0.1",
      "encoding": "graphx",
      "from": {
        "node": "generator",
        "port": "samples"
      },
      "id": "samples",
      "listener": "transform.samples",
      "schema": "Sample",
      "security": {
        "profile": "none"
      },
      "settings": {
        "backpressure": "block",
        "capacity": 8,
        "connect_timeout_ms": 5000,
        "max_message_bytes": 4096,
        "segment": "gx-shm-samples",
        "send_timeout_ms": 2000
      },
      "source_address": "127.0.0.1",
      "to": {
        "node": "transform",
        "port": "samples"
      },
      "transport": "shared_memory"
    },
    {
      "attachments": {},
      "destination_address": "127.0.0.1",
      "encoding": "graphx",
      "from": {
        "node": "transform",
        "port": "transformed"
      },
      "id": "transformed",
      "listener": "sink.transformed",
      "schema": "TransformedSample",
      "security": {
        "profile": "none"
      },
      "settings": {
        "backpressure": "block",
        "capacity": 8,
        "connect_timeout_ms": 5000,
        "max_message_bytes": 4096,
        "segment": "gx-shm-transformed",
        "send_timeout_ms": 2000
      },
      "source_address": "127.0.0.1",
      "to": {
        "node": "sink",
        "port": "transformed"
      },
      "transport": "shared_memory"
    }
  ],
  "contract_version": 2,
  "credential_references": [
    "observer",
    "runtime-generator",
    "runtime-sink",
    "runtime-transform"
  ],
  "execution_values": [
    "GX_STATE",
    "GX_CREDENTIALS",
    "GX_OUTPUT",
    "GX_RELEASE",
    "GX_OWNER"
  ],
  "graph_id": "shared-memory",
  "graph_version": 3,
  "input_digest": "4fadf7c33562a2327ccd931d6ec7d63f66010ad85b164c88d925565c704cdab5",
  "network": {
    "management_isolation": {
      "application_bind": "selected-data-address",
      "ip_forward": false,
      "ovs_management_acl": "only platform TCP 8080 and UDP 9000; deny node-to-node and forwarding; enforced before release barrier",
      "per_node_network": true,
      "platform_routes_data": false
    }
  },
  "nodes": [
    {
      "bindings": {
        "samples": [
          {
            "attachments": {},
            "connection": "samples",
            "destination_address": "127.0.0.1",
            "encoding": "graphx",
            "role": "connect",
            "schema": "Sample",
            "security": {
              "profile": "none"
            },
            "settings": {
              "backpressure": "block",
              "capacity": 8,
              "connect_timeout_ms": 5000,
              "max_message_bytes": 4096,
              "segment": "gx-shm-samples",
              "send_timeout_ms": 2000
            },
            "source_address": "127.0.0.1",
            "transport": "shared_memory"
          }
        ]
      },
      "capture": {
        "directory": "${GX_STATE}/captures/generator",
        "enabled": false,
        "max_file_bytes": 67108864,
        "max_files": 2,
        "max_packets": 100000,
        "provider": "application",
        "retention_seconds": 86400
      },
      "contract_version": 2,
      "credentials": {},
      "execution": {
        "ipc_domain": "local",
        "kind": "native"
      },
      "graph_id": "shared-memory",
      "graph_version": 3,
      "node_id": "generator",
      "observation": [
        "graphx"
      ],
      "parameters": {
        "interval_ms": 50,
        "max_messages": 20
      },
      "readiness": {
        "kind": "local-bound",
        "timeout_ms": 30000
      },
      "startup": {
        "bind_before_connect": true,
        "max_wait_ms": 30000,
        "release_barrier": true
      },
      "telemetry": {
        "credential": "runtime-generator",
        "host": "127.0.0.1",
        "port": 9000
      },
      "type": "sample.source",
      "type_revision": 1
    },
    {
      "bindings": {
        "transformed": [
          {
            "attachments": {},
            "connection": "transformed",
            "destination_address": "127.0.0.1",
            "encoding": "graphx",
            "role": "listen",
            "schema": "TransformedSample",
            "security": {
              "profile": "none"
            },
            "settings": {
              "backpressure": "block",
              "capacity": 8,
              "connect_timeout_ms": 5000,
              "max_message_bytes": 4096,
              "segment": "gx-shm-transformed",
              "send_timeout_ms": 2000
            },
            "source_address": "127.0.0.1",
            "transport": "shared_memory"
          }
        ]
      },
      "capture": {
        "directory": "${GX_STATE}/captures/sink",
        "enabled": false,
        "max_file_bytes": 67108864,
        "max_files": 2,
        "max_packets": 100000,
        "provider": "application",
        "retention_seconds": 86400
      },
      "contract_version": 2,
      "credentials": {},
      "execution": {
        "ipc_domain": "local",
        "kind": "native"
      },
      "graph_id": "shared-memory",
      "graph_version": 3,
      "node_id": "sink",
      "observation": [
        "graphx"
      ],
      "parameters": {
        "max_messages": 20
      },
      "readiness": {
        "kind": "local-bound",
        "timeout_ms": 30000
      },
      "startup": {
        "bind_before_connect": true,
        "max_wait_ms": 30000,
        "release_barrier": true
      },
      "telemetry": {
        "credential": "runtime-sink",
        "host": "127.0.0.1",
        "port": 9000
      },
      "type": "sample.sink",
      "type_revision": 1
    },
    {
      "bindings": {
        "samples": [
          {
            "attachments": {},
            "connection": "samples",
            "destination_address": "127.0.0.1",
            "encoding": "graphx",
            "role": "listen",
            "schema": "Sample",
            "security": {
              "profile": "none"
            },
            "settings": {
              "backpressure": "block",
              "capacity": 8,
              "connect_timeout_ms": 5000,
              "max_message_bytes": 4096,
              "segment": "gx-shm-samples",
              "send_timeout_ms": 2000
            },
            "source_address": "127.0.0.1",
            "transport": "shared_memory"
          }
        ],
        "transformed": [
          {
            "attachments": {},
            "connection": "transformed",
            "destination_address": "127.0.0.1",
            "encoding": "graphx",
            "role": "connect",
            "schema": "TransformedSample",
            "security": {
              "profile": "none"
            },
            "settings": {
              "backpressure": "block",
              "capacity": 8,
              "connect_timeout_ms": 5000,
              "max_message_bytes": 4096,
              "segment": "gx-shm-transformed",
              "send_timeout_ms": 2000
            },
            "source_address": "127.0.0.1",
            "transport": "shared_memory"
          }
        ]
      },
      "capture": {
        "directory": "${GX_STATE}/captures/transform",
        "enabled": false,
        "max_file_bytes": 67108864,
        "max_files": 2,
        "max_packets": 100000,
        "provider": "application",
        "retention_seconds": 86400
      },
      "contract_version": 2,
      "credentials": {},
      "execution": {
        "ipc_domain": "local",
        "kind": "native"
      },
      "graph_id": "shared-memory",
      "graph_version": 3,
      "node_id": "transform",
      "observation": [
        "graphx"
      ],
      "parameters": {
        "factor": 2,
        "max_messages": 20
      },
      "readiness": {
        "kind": "local-bound",
        "timeout_ms": 30000
      },
      "startup": {
        "bind_before_connect": true,
        "max_wait_ms": 30000,
        "release_barrier": true
      },
      "telemetry": {
        "credential": "runtime-transform",
        "host": "127.0.0.1",
        "port": 9000
      },
      "type": "sample.transform",
      "type_revision": 1
    }
  ],
  "ordering": "lexicographic-ascii",
  "platform": {
    "capture": {
      "directory": "${GX_STATE}/captures",
      "enabled": false,
      "max_file_bytes": 67108864,
      "max_files": 2,
      "max_packets": 100000,
      "provider": "application",
      "retention_seconds": 86400
    },
    "console": {
      "bind": "127.0.0.1",
      "port": 8080
    },
    "control": {
      "allowed_origins": [
        "http://127.0.0.1:8080"
      ],
      "enabled": false,
      "grants": [],
      "idempotency_ttl_seconds": 3600,
      "max_audit_records": 4096,
      "max_request_bytes": 4096
    },
    "credential_manifest": "credentials.json",
    "extensions": [],
    "history": {
      "backend": "sqlite",
      "batch_size": 100,
      "database_file": "${GX_STATE}/history/history.sqlite",
      "enabled": true,
      "flush_interval_ms": 250,
      "max_database_bytes": 268435456,
      "max_pending_queries": 16,
      "max_queue_bytes": 8388608,
      "max_records": 100000,
      "query_limit": 200,
      "query_timeout_ms": 2000,
      "queue_capacity": 4096,
      "retention_seconds": 604800,
      "shutdown_timeout_ms": 2000
    },
    "image": "graphx-design/platform@sha256:41b3db89b6ec78cab84b29c12a1af5024ba670b44463edc40d887cad8b952ba4",
    "normalization": "resolved.json",
    "otlp": {
      "enabled": false
    },
    "telemetry": {
      "authentication": "per-node-hmac",
      "heartbeat_interval_ms": 1000,
      "heartbeat_timeout_ms": 5000,
      "host": "127.0.0.1",
      "port": 9000
    },
    "template": "platform-v1"
  },
  "portable_network": null,
  "target": "native-linux"
}
